{
  "schema": "watchdog.event.v1",
  "event_id": "d4e5f6a7-b8c9-4def-a123-456789abcdef",
  "flow_id": "METEO_STAT_DAILY",
  "event_type": "execution_completed",
  "status": "success",
  "timestamp": "2026-10-23T02:31:00.000Z",
  "source_id": "SRC_SQLSERVER_METEO",
  "connector_id": "CONN_DJU_DAILY",
  "destination_id": "DST_SQL_GENEVE_METEO_STAT",
  "execution_id": "dju-daily:2026-10-23:2026-10-23T02:30:00.000Z",
  "duration_ms": 1800,
  "producer": "dju-daily",
  "metadata": {
    "step": "readback",
    "verified": true,
    "slot_date": "2026-10-23",
    "through": "2026-10-22"
  }
}
