{
  "schema": "watchdog.event.v1",
  "event_id": "01K3N7R5WQK8M2P9X5C6B1A0ZT",
  "flow_id": "CSV_OASSIS_01",
  "event_type": "execution_completed",
  "status": "success",
  "timestamp": "2026-08-24T11:00:00Z",
  "source_id": "SRC_SMB_OASSIS",
  "connector_id": "CONN_CSV_TO_SQL",
  "destination_id": "DST_SQL_PLUTO",
  "execution_id": "run-oassis-20260824T1100Z",
  "duration_ms": 4200,
  "records": 1540,
  "producer": "csv-to-sql",
  "metadata": {
    "file_name": "MUC_20260824.csv"
  }
}
